Keyword,Intent,Related,Volume,Keyword Difficulty,CPC (USD),SERP Features
convert pdf table to excel,Informational,0.05,590,73,2.26,"Sitelinks, AI Overview, Video, Related searches, Ads bottom, Ads middle"
extract data from pdf,"Informational, Commercial",0.05,590,35,7.07,"Sitelinks, AI Overview, Video, Related searches"
export pdf table to excel,Informational,0.05,480,47,2.26,"Sitelinks, AI Overview, Video, Related searches, Ads bottom, Ads middle"
pdf table to excel,,0.15,480,87,2.45,"Sitelinks, Video, People also ask, Related searches"
copy table from pdf to excel,Informational,0.05,390,21,2.35,"Sitelinks, AI Overview, Video, Related searches"
extract data from pdf to excel,Informational,0.05,390,44,5.63,"Sitelinks, AI Overview, Video, Video carousel, People also ask, Discussions and forums, Related searches, Ads bottom, Ads middle"
how to copy table from pdf to excel,Informational,0.05,320,27,1.18,"Sitelinks, AI Overview, Video, Discussions and forums, Related searches"
extract table data from pdf,Informational,0.55,260,12,3.77,"Sitelinks, Image pack, Video, Related searches"
extract tables from pdf,Informational,0.50,260,5,3.77,"Sitelinks, Image pack, Video, Related searches, Ads top"
parse table from pdf,Informational,0.65,140,12,4.98,"Sitelinks, Video, Related searches"
how to extract table from pdf,Informational,0.65,70,23,2.85,"Sitelinks, AI Overview, Image pack, Video, People also ask, Related searches, Ads bottom, Ads middle"
extract a table from pdf,Informational,0.60,40,13,3.77,"Sitelinks, AI Overview, Image pack, Video, People also ask, Related searches"
extracting tables from pdf,"Informational, Commercial",0.60,30,14,3.77,"Sitelinks, AI Overview, Video, Related searches, Ads top"
pdf to table extractor,"Informational, Commercial",0.60,30,13,4.35,"Sitelinks, Video, Related searches, Ads top"
table from pdf,Informational,0.60,30,26,3.42,"Sitelinks, Image pack, Video, People also ask, Related searches"
